{
  "version": "1.1",
  "status": "ACTIVE",
  "description": "Derived outcome-to-food relationships generated from foods' mechanism profiles (food-mechanisms.json) matched against each outcome's candidateMechanisms (outcomes.json). This file is DERIVED, not hand-curated: it must be regenerated whenever food-mechanisms.json or outcomes.json change. Score is contribution-weighted (sum of matched mechanisms' strength/5 x confidence, each mechanism discarded below a 0.5 contribution threshold), not a coverage ratio, so outcomes with long candidate-mechanism lists are not structurally penalised relative to outcomes with short ones. 'coverage' (matched/required) is retained as an informational field only and does not drive ranking or evidenceScore. evidenceScore normalises the raw contribution score to 0-100 against the top-scoring food for that specific outcome; scores are only ever comparable within one outcome's list, never across outcomes.",
  "generationRule": "sum(strength/5 x confidence) over each food's mechanisms that are also in the outcome's candidateMechanisms, discarding any single mechanism contribution below 0.5, then normalised 0-100 against the top food for that outcome.",
  "outcomeCount": 9,
  "foodOutcomeRelationshipCount": 234,
  "outcomes": [
    {
      "outcomeId": "OUT001",
      "outcome": "Better Sleep",
      "foodCount": 4,
      "foods": [
        {
          "id": "FD030",
          "name": "Salmon",
          "matchedMechanisms": [
            "MEC057"
          ],
          "matchedMechanismCount": 1,
          "requiredMechanismCount": 2,
          "coverage": 0.5,
          "averageStrength": 4.0,
          "evidenceScore": 100.0
        },
        {
          "id": "FD031",
          "name": "Sardines",
          "matchedMechanisms": [
            "MEC057"
          ],
          "matchedMechanismCount": 1,
          "requiredMechanismCount": 2,
          "coverage": 0.5,
          "averageStrength": 4.0,
          "evidenceScore": 100.0
        },
        {
          "id": "FD032",
          "name": "Mackerel",
          "matchedMechanisms": [
            "MEC057"
          ],
          "matchedMechanismCount": 1,
          "requiredMechanismCount": 2,
          "coverage": 0.5,
          "averageStrength": 4.0,
          "evidenceScore": 100.0
        },
        {
          "id": "FD033",
          "name": "Herring",
          "matchedMechanisms": [
            "MEC057"
          ],
          "matchedMechanismCount": 1,
          "requiredMechanismCount": 2,
          "coverage": 0.5,
          "averageStrength": 4.0,
          "evidenceScore": 100.0
        }
      ]
    },
    {
      "outcomeId": "OUT002",
      "outcome": "More Energy",
      "foodCount": 42,
      "foods": [
        {
          "id": "FD006",
          "name": "Spinach",
          "matchedMechanisms": [
            "MEC044"
          ],
          "matchedMechanismCount": 1,
          "requiredMechanismCount": 2,
          "coverage": 0.5,
          "averageStrength": 5.0,
          "evidenceScore": 100.0
        },
        {
          "id": "FD007",
          "name": "Kale",
          "matchedMechanisms": [
            "MEC044"
          ],
          "matchedMechanismCount": 1,
          "requiredMechanismCount": 2,
          "coverage": 0.5,
          "averageStrength": 5.0,
          "evidenceScore": 100.0
        },
        {
          "id": "FD010",
          "name": "Broccoli",
          "matchedMechanisms": [
            "MEC044"
          ],
          "matchedMechanismCount": 1,
          "requiredMechanismCount": 2,
          "coverage": 0.5,
          "averageStrength": 5.0,
          "evidenceScore": 100.0
        },
        {
          "id": "FD011",
          "name": "Brussels Sprouts",
          "matchedMechanisms": [
            "MEC044"
          ],
          "matchedMechanismCount": 1,
          "requiredMechanismCount": 2,
          "coverage": 0.5,
          "averageStrength": 5.0,
          "evidenceScore": 100.0
        },
        {
          "id": "FD012",
          "name": "Cauliflower",
          "matchedMechanisms": [
            "MEC044"
          ],
          "matchedMechanismCount": 1,
          "requiredMechanismCount": 2,
          "coverage": 0.5,
          "averageStrength": 5.0,
          "evidenceScore": 100.0
        },
        {
          "id": "FD013",
          "name": "Cabbage",
          "matchedMechanisms": [
            "MEC044"
          ],
          "matchedMechanismCount": 1,
          "requiredMechanismCount": 2,
          "coverage": 0.5,
          "averageStrength": 5.0,
          "evidenceScore": 100.0
        },
        {
          "id": "FD022",
          "name": "Flaxseed",
          "matchedMechanisms": [
            "MEC044"
          ],
          "matchedMechanismCount": 1,
          "requiredMechanismCount": 2,
          "coverage": 0.5,
          "averageStrength": 5.0,
          "evidenceScore": 100.0
        },
        {
          "id": "FD027",
          "name": "Tomatoes",
          "matchedMechanisms": [
            "MEC044"
          ],
          "matchedMechanismCount": 1,
          "requiredMechanismCount": 2,
          "coverage": 0.5,
          "averageStrength": 5.0,
          "evidenceScore": 100.0
        },
        {
          "id": "FD030",
          "name": "Salmon",
          "matchedMechanisms": [
            "MEC044"
          ],
          "matchedMechanismCount": 1,
          "requiredMechanismCount": 2,
          "coverage": 0.5,
          "averageStrength": 5.0,
          "evidenceScore": 100.0
        },
        {
          "id": "FD031",
          "name": "Sardines",
          "matchedMechanisms": [
            "MEC044"
          ],
          "matchedMechanismCount": 1,
          "requiredMechanismCount": 2,
          "coverage": 0.5,
          "averageStrength": 5.0,
          "evidenceScore": 100.0
        },
        {
          "id": "FD032",
          "name": "Mackerel",
          "matchedMechanisms": [
            "MEC044"
          ],
          "matchedMechanismCount": 1,
          "requiredMechanismCount": 2,
          "coverage": 0.5,
          "averageStrength": 5.0,
          "evidenceScore": 100.0
        },
        {
          "id": "FD033",
          "name": "Herring",
          "matchedMechanisms": [
            "MEC044"
          ],
          "matchedMechanismCount": 1,
          "requiredMechanismCount": 2,
          "coverage": 0.5,
          "averageStrength": 5.0,
          "evidenceScore": 100.0
        },
        {
          "id": "FD042",
          "name": "Oregano",
          "matchedMechanisms": [
            "MEC044"
          ],
          "matchedMechanismCount": 1,
          "requiredMechanismCount": 2,
          "coverage": 0.5,
          "averageStrength": 5.0,
          "evidenceScore": 100.0
        },
        {
          "id": "FD044",
          "name": "Black Tea",
          "matchedMechanisms": [
            "MEC044"
          ],
          "matchedMechanismCount": 1,
          "requiredMechanismCount": 2,
          "coverage": 0.5,
          "averageStrength": 5.0,
          "evidenceScore": 100.0
        },
        {
          "id": "FD046",
          "name": "Cocoa",
          "matchedMechanisms": [
            "MEC044"
          ],
          "matchedMechanismCount": 1,
          "requiredMechanismCount": 2,
          "coverage": 0.5,
          "averageStrength": 5.0,
          "evidenceScore": 100.0
        },
        {
          "id": "FD053",
          "name": "Carrots",
          "matchedMechanisms": [
            "MEC044"
          ],
          "matchedMechanismCount": 1,
          "requiredMechanismCount": 2,
          "coverage": 0.5,
          "averageStrength": 5.0,
          "evidenceScore": 100.0
        },
        {
          "id": "FD062",
          "name": "Pomegranate",
          "matchedMechanisms": [
            "MEC044"
          ],
          "matchedMechanismCount": 1,
          "requiredMechanismCount": 2,
          "coverage": 0.5,
          "averageStrength": 5.0,
          "evidenceScore": 100.0
        },
        {
          "id": "FD065",
          "name": "Sesame Seeds",
          "matchedMechanisms": [
            "MEC044"
          ],
          "matchedMechanismCount": 1,
          "requiredMechanismCount": 2,
          "coverage": 0.5,
          "averageStrength": 5.0,
          "evidenceScore": 100.0
        },
        {
          "id": "FD088",
          "name": "Sweet Potato",
          "matchedMechanisms": [
            "MEC044"
          ],
          "matchedMechanismCount": 1,
          "requiredMechanismCount": 2,
          "coverage": 0.5,
          "averageStrength": 5.0,
          "evidenceScore": 100.0
        },
        {
          "id": "FD001",
          "name": "Oats",
          "matchedMechanisms": [
            "MEC044"
          ],
          "matchedMechanismCount": 1,
          "requiredMechanismCount": 2,
          "coverage": 0.5,
          "averageStrength": 4.0,
          "evidenceScore": 80.0
        },
        {
          "id": "FD002",
          "name": "Blueberries",
          "matchedMechanisms": [
            "MEC044"
          ],
          "matchedMechanismCount": 1,
          "requiredMechanismCount": 2,
          "coverage": 0.5,
          "averageStrength": 4.0,
          "evidenceScore": 80.0
        },
        {
          "id": "FD003",
          "name": "Blackberries",
          "matchedMechanisms": [
            "MEC044"
          ],
          "matchedMechanismCount": 1,
          "requiredMechanismCount": 2,
          "coverage": 0.5,
          "averageStrength": 4.0,
          "evidenceScore": 80.0
        },
        {
          "id": "FD004",
          "name": "Strawberries",
          "matchedMechanisms": [
            "MEC044"
          ],
          "matchedMechanismCount": 1,
          "requiredMechanismCount": 2,
          "coverage": 0.5,
          "averageStrength": 4.0,
          "evidenceScore": 80.0
        },